{
  "country": "Greece",
  "country_code": "GR",
  "last_updated": "2026-07-01",
  "schengen_member": true,
  "currency": "EUR",
  "official_language": "Greek",
  "qualifying_courses": {
    "long_stay": [
      "Higher education (Bachelor's, Master's, PhD)",
      "Vocational training programs at recognized institutions",
      "Language preparation courses (prerequisite for higher education)",
      "Research programs at recognized Greek research centers",
      "Exchange programs (e.g., Erasmus+)"
    ],
    "short_stay": [],
    "notes": "Institutions must be accredited/certified by the Greek Ministry of Education."
  },
  "visa": {
    "types": [
      {
        "code": "D",
        "name": "National Long-stay Study Visa",
        "validity_days": null,
        "entries": null,
        "for_stays_over_days": 90,
        "notes": "For stays exceeding 90 days, for students enrolled in recognized higher education institutions, language schools, or vocational training programs."
      }
    ],
    "application_process": {
      "booking_methods": [
        {
          "method": "Embassy/Consulate Online Portal",
          "description": "Book directly through the official website of the competent Greek Embassy or Consulate in your country of residence.",
          "url": "https://www.mfa.gr/en/contact/greek-missions-abroad/"
        },
        {
          "method": "Global Visa Center World (GVCW)",
          "description": "External service provider used by the Greek Ministry of Foreign Affairs in certain countries/cities for visa application appointments.",
          "url": null
        },
        {
          "method": "VFS Global",
          "description": "Third-party service used in some countries for appointment booking.",
          "url": null
        }
      ],
      "steps": [
        {
          "step": 1,
          "title": "Receive Letter of Acceptance",
          "description": "Obtain an official Letter of Acceptance from a recognized Greek educational institution.",
          "action_required": null
        },
        {
          "step": 2,
          "title": "Gather Required Documents",
          "description": "Collect all necessary documentation, including criminal record, health certificate, financial proof, and others.",
          "action_required": null
        },
        {
          "step": 3,
          "title": "Book Visa Appointment",
          "description": "Schedule an appointment at the competent Greek Embassy or Consulate, or through an external service provider.",
          "action_required": null
        },
        {
          "step": 4,
          "title": "Attend Interview and Submit Application",
          "description": "Attend the in-person interview, submit the completed application form and all supporting documents, and provide biometric data (fingerprints).",
          "action_required": null
        },
        {
          "step": 5,
          "title": "Pay Visa Fee",
          "description": "Pay the required visa application fee.",
          "action_required": null
        },
        {
          "step": 6,
          "title": "Await Visa Decision",
          "description": "Wait for the processing of the application and the visa decision.",
          "action_required": null
        }
      ],
      "processing_time": {
        "legal_deadline_days": 60,
        "typical_min_days": 28,
        "typical_max_days": 84,
        "recommended_apply_before_start_days": 90
      },
      "fee_eur": 90,
      "interview_required": true
    }
  },
  "required_documents": [
    {
      "id": "passport",
      "name": "Valid Passport",
      "details": "Valid for at least 3 months beyond intended stay, with at least two blank pages.",
      "mandatory": true,
      "apostille_required": null,
      "exemptions": [],
      "notes": null
    },
    {
      "id": "visa_application_form",
      "name": "Completed National Visa Application Form",
      "details": null,
      "mandatory": true,
      "apostille_required": null,
      "exemptions": [],
      "notes": null
    },
    {
      "id": "photos",
      "name": "Passport-sized Photographs",
      "details": "Two recent (within 6 months) passport-sized color photographs meeting ICAO/Schengen specifications.",
      "mandatory": true,
      "apostille_required": null,
      "exemptions": [],
      "notes": null
    },
    {
      "id": "acceptance_letter",
      "name": "Official Letter of Acceptance/Enrolment",
      "details": "From a Greek educational institution, specifying program, duration, and tuition fees.",
      "mandatory": true,
      "apostille_required": null,
      "exemptions": [],
      "notes": null
    },
    {
      "id": "language_proficiency",
      "name": "Proof of Language Proficiency",
      "details": "Required for the specific course of study.",
      "mandatory": true,
      "apostille_required": null,
      "exemptions": [],
      "notes": null
    },
    {
      "id": "criminal_record",
      "name": "Criminal Record Certificate",
      "details": "From home country and any country of residence in the past 5 years, legalized (Apostille) and officially translated into Greek.",
      "mandatory": true,
      "apostille_required": true,
      "exemptions": [],
      "notes": null
    },
    {
      "id": "medical_certificate",
      "name": "Medical Certificate",
      "details": "From a recognized state or private doctor, confirming freedom from contagious diseases as defined by the World Health Organization. Must be legalized (Apostille) and officially translated into Greek.",
      "mandatory": true,
      "apostille_required": true,
      "exemptions": [],
      "notes": null
    },
    {
      "id": "health_insurance",
      "name": "Health/Travel Insurance",
      "details": "Comprehensive medical/travel insurance valid in the Schengen area, covering the duration of the visa, with minimum coverage of €30,000.",
      "mandatory": true,
      "apostille_required": null,
      "exemptions": [],
      "notes": null
    },
    {
      "id": "visa_fee_proof",
      "name": "Proof of Visa Fee Payment",
      "details": null,
      "mandatory": true,
      "apostille_required": null,
      "exemptions": [],
      "notes": null
    },
    {
      "id": "financial_proof",
      "name": "Proof of Sufficient Financial Means",
      "details": "Bank statements, scholarship certificates, or sponsorship declaration, demonstrating the required monthly amount.",
      "mandatory": true,
      "apostille_required": null,
      "exemptions": [],
      "notes": null
    },
    {
      "id": "enrolment_fees_proof",
      "name": "Proof of Paid Enrolment Fees",
      "details": "Where applicable.",
      "mandatory": false,
      "apostille_required": null,
      "exemptions": [],
      "notes": null
    },
    {
      "id": "accommodation_proof",
      "name": "Proof of Accommodation",
      "details": "Rental agreement, dormitory reservation, or host letter in Greece.",
      "mandatory": true,
      "apostille_required": null,
      "exemptions": [],
      "notes": null
    }
  ],
  "financial_requirements": {
    "reference_value_monthly_eur": 400,
    "reference_basis": "Joint Ministerial Decree No. 41712/2014 (Ministry of Foreign Affairs, Visa and Residence Permit Guide for Students)",
    "year": null,
    "calculation_rules": {
      "first_adult_pct": 100,
      "additional_adult_pct": null,
      "dependent_child_pct": null
    },
    "example_12_months_eur": 4800,
    "acceptable_proof": [
      "Bank statements (last 6 months)",
      "Scholarship certificates",
      "Affidavit of support/Sponsorship declaration (with sponsor's financial documents)",
      "Proof of a blocked account"
    ],
    "exemptions": []
  },
  "residence_permit": {
    "authority_name": "Ministry of Migration and Asylum",
    "authority_full_name": "Ministry of Migration and Asylum",
    "authority_url": "https://migration.gov.gr/en/",
    "apply_within_days_of_arrival": 90,
    "validity_months": 12,
    "renewable": true,
    "booking_method": "Electronically through the Ministry of Migration and Asylum portal (applications.migration.gov.gr), followed by an in-person appointment at the Aliens and Immigration Department for biometrics.",
    "required_documents": [
      "Valid passport",
      "D-type visa",
      "Official acceptance/enrolment letter",
      "Proof of sufficient financial means",
      "Comprehensive health insurance",
      "Proof of accommodation",
      "Tax Identification Number (AFM)",
      "Social Security Number (AMKA)",
      "Translated and apostilled/legalized documents as required"
    ],
    "notes": "A fee of 150 EUR is required per year. Upon online submission, applicants receive a 'Blue Paper' (Vevaiosi) serving as a temporary residence permit until the electronic card is issued."
  },
  "work_while_studying": {
    "allowed": true,
    "max_hours_per_week_during_term": 20,
    "full_time_during_breaks": true,
    "requires_notification": null,
    "notification_authority": null,
    "legal_basis": null,
    "restrictions": [
      "Part-time work only during the academic semester."
    ],
    "notes": "Students must obtain a Tax Identification Number (AFM) and a Social Security Number (AMKA) to be legally employed."
  },
  "permit_renewal": {
    "apply_before_expiry_min_days": 60,
    "apply_before_expiry_max_days": 90,
    "online_portal": "https://applications.migration.gov.gr/en/metanasteusi/",
    "required_documents": [
      "Proof of continued enrollment",
      "Evidence of successful completion of exams/progress in studies",
      "Updated proof of financial means",
      "Updated health insurance for the new period"
    ],